{
  "id": "wespe_einzeln",
  "name_key": "threat.wespe_einzeln.name",
  "text_key": "threat.wespe_einzeln.text",
  "hp": 18,
  "act": 1,
  "is_boss": false,
  "escalation": { "type": "none", "value": 0 },
  "intents": [
    { "id": "stich", "name_key": "threat.wespe_einzeln.intent.stich", "weight": 3, "min_turn": 1,
      "effects": [ { "op": "deal_damage", "value": 5, "target": "colony" } ] },
    { "id": "umkreisen", "name_key": "threat.wespe_einzeln.intent.umkreisen", "weight": 1, "min_turn": 1,
      "effects": [ { "op": "add_varroa", "value": 1, "target": "colony" } ] }
  ]
}
